{
  "$schema": "http://json-schema.org/draft-07/schema#",
  "$id": "schema/route.schema.json",
  "title": "Route stops",
  "description": "Shape contract for shared/data/route.json. Generated by tools/studio/gen-schemas.mjs — edit the generator, not this file.",
  "type": "object",
  "required": [
    "emberPointSources",
    "postLaunchExpansion",
    "stops",
    "version"
  ],
  "additionalProperties": false,
  "properties": {
    "$schema": {
      "type": "string"
    },
    "_comment": {
      "type": "string"
    },
    "emberPointSources": {
      "type": "object",
      "properties": {
        "comboMilestone": {
          "type": "integer"
        },
        "customerServed": {
          "type": "integer"
        },
        "dailyMissionsAll": {
          "type": "integer"
        },
        "perfectCook": {
          "type": "integer"
        },
        "turnFlawless": {
          "type": "integer"
        },
        "weeklyMissionsAll": {
          "type": "integer"
        }
      },
      "required": [
        "comboMilestone",
        "customerServed",
        "dailyMissionsAll",
        "perfectCook",
        "turnFlawless",
        "weeklyMissionsAll"
      ]
    },
    "postLaunchExpansion": {
      "type": "object",
      "properties": {
        "note": {
          "type": "string"
        },
        "stopsPerSeason": {
          "type": "integer"
        }
      },
      "required": [
        "note",
        "stopsPerSeason"
      ]
    },
    "stops": {
      "type": "array",
      "items": {
        "type": "object",
        "properties": {
          "challenge": {
            "type": "object",
            "properties": {
              "goal": {
                "type": "integer"
              },
              "ingredient": {
                "type": "string"
              },
              "type": {
                "enum": [
                  "bossTurn",
                  "combo",
                  "flawlessTurns",
                  "ingredient",
                  "lowZoneOnly",
                  "perfect",
                  "serve",
                  "slowCookNoBurn"
                ]
              }
            },
            "required": [
              "goal",
              "type"
            ]
          },
          "emberCost": {
            "type": "integer"
          },
          "id": {
            "type": "string",
            "pattern": "^[a-z][a-z0-9_]*$"
          },
          "index": {
            "type": "integer"
          },
          "nameKey": {
            "type": "string"
          },
          "region": {
            "enum": [
              "centro_oeste",
              "nordeste",
              "norte",
              "sudeste",
              "sul"
            ]
          },
          "reward": {
            "type": "object",
            "properties": {
              "coins": {
                "type": "integer"
              },
              "collection": {
                "type": "string"
              },
              "decor": {
                "type": "string"
              },
              "embers": {
                "type": "integer"
              },
              "equipment": {
                "type": "string"
              },
              "ingredient": {
                "enum": [
                  "carne_de_sol",
                  "costela",
                  "maminha",
                  "pao_de_alho"
                ]
              },
              "skin": {
                "type": "string"
              }
            }
          },
          "storyKey": {
            "type": "string"
          }
        },
        "required": [
          "challenge",
          "emberCost",
          "id",
          "index",
          "nameKey",
          "region",
          "reward",
          "storyKey"
        ]
      }
    },
    "version": {
      "type": "integer"
    }
  }
}
